{
  "id": "nord",
  "name": "Nord",
  "type": "dark",
  "author": "Arctic Ice Studio (port: Baris Can Sayin)",
  "description": "An arctic, north-bluish color palette. Polar Night base, Snow Storm foreground, Frost primaries, Aurora accents.",
  "ui": {
    "background": "#2e3440",
    "foreground": "#d8dee9",
    "card": "#3b4252",
    "cardForeground": "#eceff4",
    "popover": "#3b4252",
    "popoverForeground": "#eceff4",
    "primary": "#88c0d0",
    "primaryForeground": "#2e3440",
    "secondary": "#434c5e",
    "secondaryForeground": "#eceff4",
    "muted": "#434c5e",
    "mutedForeground": "#7b88a1",
    "accent": "#4c566a",
    "accentForeground": "#eceff4",
    "tertiary": "#272b35",
    "tertiaryActive": "#4c566a",
    "destructive": "#bf616a",
    "destructiveForeground": "#eceff4",
    "border": "#4c566a",
    "input": "#3b4252",
    "ring": "#88c0d0",
    "sidebar": "#272b35",
    "sidebarForeground": "#d8dee9",
    "sidebarPrimary": "#88c0d0",
    "sidebarPrimaryForeground": "#2e3440",
    "sidebarAccent": "#3b4252",
    "sidebarAccentForeground": "#eceff4",
    "sidebarBorder": "#3b4252",
    "sidebarRing": "#88c0d0",
    "chart1": "#bf616a",
    "chart2": "#a3be8c",
    "chart3": "#88c0d0",
    "chart4": "#ebcb8b",
    "chart5": "#b48ead",
    "highlightMatch": "rgba(235, 203, 139, 0.22)",
    "highlightActive": "rgba(235, 203, 139, 0.5)",
    "highlight": "#ebcb8b",
    "highlightForeground": "#2e3440"
  },
  "terminal": {
    "background": "#2e3440",
    "foreground": "#d8dee9",
    "cursor": "#d8dee9",
    "cursorAccent": "#2e3440",
    "selectionBackground": "rgba(76, 86, 106, 0.7)",
    "black": "#3b4252",
    "red": "#bf616a",
    "green": "#a3be8c",
    "yellow": "#ebcb8b",
    "blue": "#81a1c1",
    "magenta": "#b48ead",
    "cyan": "#88c0d0",
    "white": "#e5e9f0",
    "brightBlack": "#4c566a",
    "brightRed": "#bf616a",
    "brightGreen": "#a3be8c",
    "brightYellow": "#ebcb8b",
    "brightBlue": "#81a1c1",
    "brightMagenta": "#b48ead",
    "brightCyan": "#8fbcbb",
    "brightWhite": "#eceff4"
  }
}
