{
  "id": "hangar",
  "name": "Hangar",
  "type": "dark",
  "author": "Baris Can Sayin",
  "description": "Working warehouse at end of shift — concrete grey, safety orange, diesel yellow, exit-sign red. Functional, not decorative.",
  "ui": {
    "background": "#1c1d1f",
    "foreground": "#e8e6df",
    "card": "#26282b",
    "cardForeground": "#e8e6df",
    "popover": "#26282b",
    "popoverForeground": "#e8e6df",
    "primary": "#ff6b1a",
    "primaryForeground": "#1c1d1f",
    "secondary": "#2e3034",
    "secondaryForeground": "#e8e6df",
    "muted": "#2e3034",
    "mutedForeground": "#8c8d92",
    "accent": "#3a3d42",
    "accentForeground": "#f5f3ec",
    "tertiary": "#16171a",
    "tertiaryActive": "#3a3d42",
    "destructive": "#d62828",
    "destructiveForeground": "#f5f3ec",
    "border": "#3a3d42",
    "input": "#26282b",
    "ring": "#ff6b1a",
    "sidebar": "#16171a",
    "sidebarForeground": "#cfcec5",
    "sidebarPrimary": "#ff6b1a",
    "sidebarPrimaryForeground": "#1c1d1f",
    "sidebarAccent": "#26282b",
    "sidebarAccentForeground": "#e8e6df",
    "sidebarBorder": "#26282b",
    "sidebarRing": "#ff6b1a",
    "chart1": "#d62828",
    "chart2": "#9aa066",
    "chart3": "#5c8b9b",
    "chart4": "#e6c34c",
    "chart5": "#ff6b1a",
    "highlightMatch": "rgba(230, 195, 76, 0.18)",
    "highlightActive": "rgba(255, 107, 26, 0.4)",
    "highlight": "#e6c34c",
    "highlightForeground": "#1c1d1f"
  },
  "terminal": {
    "background": "#1c1d1f",
    "foreground": "#e8e6df",
    "cursor": "#ff6b1a",
    "cursorAccent": "#1c1d1f",
    "selectionBackground": "rgba(58, 61, 66, 0.85)",
    "black": "#16171a",
    "red": "#d62828",
    "green": "#9aa066",
    "yellow": "#e6c34c",
    "blue": "#5c8b9b",
    "magenta": "#a85a3a",
    "cyan": "#7ea3a8",
    "white": "#cfcec5",
    "brightBlack": "#3a3d42",
    "brightRed": "#ef4444",
    "brightGreen": "#bcc28a",
    "brightYellow": "#ffd76b",
    "brightBlue": "#7da6b8",
    "brightMagenta": "#c87a5a",
    "brightCyan": "#a3c4c9",
    "brightWhite": "#f5f3ec"
  }
}
