{
  "id": "solarized-dark",
  "name": "Solarized Dark",
  "type": "dark",
  "author": "Ethan Schoonover (port: Baris Can Sayin)",
  "description": "Precision colors engineered for legibility — dark variant. Same accents as Solarized Light; only base tones flip.",
  "ui": {
    "background": "#002b36",
    "foreground": "#93a1a1",
    "card": "#073642",
    "cardForeground": "#eee8d5",
    "popover": "#073642",
    "popoverForeground": "#eee8d5",
    "primary": "#268bd2",
    "primaryForeground": "#002b36",
    "secondary": "#073642",
    "secondaryForeground": "#93a1a1",
    "muted": "#073642",
    "mutedForeground": "#586e75",
    "accent": "#073642",
    "accentForeground": "#eee8d5",
    "tertiary": "#001f27",
    "tertiaryActive": "#073642",
    "destructive": "#dc322f",
    "destructiveForeground": "#fdf6e3",
    "border": "#073642",
    "input": "#073642",
    "ring": "#268bd2",
    "sidebar": "#001f27",
    "sidebarForeground": "#93a1a1",
    "sidebarPrimary": "#268bd2",
    "sidebarPrimaryForeground": "#002b36",
    "sidebarAccent": "#073642",
    "sidebarAccentForeground": "#eee8d5",
    "sidebarBorder": "#073642",
    "sidebarRing": "#268bd2",
    "chart1": "#dc322f",
    "chart2": "#859900",
    "chart3": "#2aa198",
    "chart4": "#b58900",
    "chart5": "#6c71c4",
    "highlightMatch": "rgba(181, 137, 0, 0.18)",
    "highlightActive": "rgba(181, 137, 0, 0.45)",
    "highlight": "#b58900",
    "highlightForeground": "#fdf6e3"
  },
  "terminal": {
    "background": "#002b36",
    "foreground": "#839496",
    "cursor": "#93a1a1",
    "cursorAccent": "#002b36",
    "selectionBackground": "rgba(7, 54, 66, 0.95)",
    "black": "#073642",
    "red": "#dc322f",
    "green": "#859900",
    "yellow": "#b58900",
    "blue": "#268bd2",
    "magenta": "#d33682",
    "cyan": "#2aa198",
    "white": "#eee8d5",
    "brightBlack": "#586e75",
    "brightRed": "#cb4b16",
    "brightGreen": "#586e75",
    "brightYellow": "#657b83",
    "brightBlue": "#839496",
    "brightMagenta": "#6c71c4",
    "brightCyan": "#93a1a1",
    "brightWhite": "#fdf6e3"
  }
}
