{
  "id": "twilight-run",
  "name": "Twilight Run",
  "type": "dark",
  "author": "Baris Can Sayin",
  "description": "After the streetlights, before full night. Pre-dawn navy meets sodium-vapor orange — a single moment captured.",
  "ui": {
    "background": "#0e1b2a",
    "foreground": "#dde3ee",
    "card": "#1c2638",
    "cardForeground": "#dde3ee",
    "popover": "#1c2638",
    "popoverForeground": "#dde3ee",
    "primary": "#ff8a3d",
    "primaryForeground": "#0e1b2a",
    "secondary": "#243042",
    "secondaryForeground": "#dde3ee",
    "muted": "#243042",
    "mutedForeground": "#6e83a3",
    "accent": "#2e3a4e",
    "accentForeground": "#dde3ee",
    "tertiary": "#0a1320",
    "tertiaryActive": "#2e3a4e",
    "destructive": "#e8526a",
    "destructiveForeground": "#0e1b2a",
    "border": "#2e3a4e",
    "input": "#1c2638",
    "ring": "#ff8a3d",
    "sidebar": "#0a1320",
    "sidebarForeground": "#bbc4d4",
    "sidebarPrimary": "#ff8a3d",
    "sidebarPrimaryForeground": "#0e1b2a",
    "sidebarAccent": "#1c2638",
    "sidebarAccentForeground": "#dde3ee",
    "sidebarBorder": "#1c2638",
    "sidebarRing": "#ff8a3d",
    "chart1": "#e8526a",
    "chart2": "#85b86a",
    "chart3": "#5b9ec4",
    "chart4": "#f5e493",
    "chart5": "#a07cd4",
    "highlightMatch": "rgba(245, 228, 147, 0.16)",
    "highlightActive": "rgba(255, 138, 61, 0.4)",
    "highlight": "#f5e493",
    "highlightForeground": "#0e1b2a"
  },
  "terminal": {
    "background": "#0e1b2a",
    "foreground": "#dde3ee",
    "cursor": "#ff8a3d",
    "cursorAccent": "#0e1b2a",
    "selectionBackground": "rgba(46, 58, 78, 0.85)",
    "black": "#0a1320",
    "red": "#e8526a",
    "green": "#85b86a",
    "yellow": "#f5e493",
    "blue": "#5b9ec4",
    "magenta": "#a07cd4",
    "cyan": "#7ec4d4",
    "white": "#bbc4d4",
    "brightBlack": "#2e3a4e",
    "brightRed": "#ff7a8a",
    "brightGreen": "#a3d488",
    "brightYellow": "#fff0aa",
    "brightBlue": "#7eb8d8",
    "brightMagenta": "#bb96e3",
    "brightCyan": "#a0d8e6",
    "brightWhite": "#eaf0fa"
  }
}
