{
  "id": "gruvbox-dark",
  "name": "Gruvbox Dark",
  "type": "dark",
  "author": "Pavel Pertsev (port: Baris Can Sayin)",
  "description": "Retro groove from Pavel Pertsev — warm dark base, ochre/olive/clay accents. Honest, woodgrain feel.",
  "ui": {
    "background": "#282828",
    "foreground": "#ebdbb2",
    "card": "#1d2021",
    "cardForeground": "#ebdbb2",
    "popover": "#1d2021",
    "popoverForeground": "#ebdbb2",
    "primary": "#fabd2f",
    "primaryForeground": "#282828",
    "secondary": "#3c3836",
    "secondaryForeground": "#ebdbb2",
    "muted": "#3c3836",
    "mutedForeground": "#a89984",
    "accent": "#504945",
    "accentForeground": "#ebdbb2",
    "tertiary": "#1d2021",
    "tertiaryActive": "#504945",
    "destructive": "#fb4934",
    "destructiveForeground": "#282828",
    "border": "#504945",
    "input": "#3c3836",
    "ring": "#fabd2f",
    "sidebar": "#1d2021",
    "sidebarForeground": "#d5c4a1",
    "sidebarPrimary": "#fabd2f",
    "sidebarPrimaryForeground": "#282828",
    "sidebarAccent": "#3c3836",
    "sidebarAccentForeground": "#ebdbb2",
    "sidebarBorder": "#3c3836",
    "sidebarRing": "#fabd2f",
    "chart1": "#fb4934",
    "chart2": "#b8bb26",
    "chart3": "#83a598",
    "chart4": "#fabd2f",
    "chart5": "#d3869b",
    "highlightMatch": "rgba(250, 189, 47, 0.18)",
    "highlightActive": "rgba(250, 189, 47, 0.45)",
    "highlight": "#fabd2f",
    "highlightForeground": "#282828"
  },
  "terminal": {
    "background": "#282828",
    "foreground": "#ebdbb2",
    "cursor": "#ebdbb2",
    "cursorAccent": "#282828",
    "selectionBackground": "rgba(80, 73, 69, 0.85)",
    "black": "#282828",
    "red": "#cc241d",
    "green": "#98971a",
    "yellow": "#d79921",
    "blue": "#458588",
    "magenta": "#b16286",
    "cyan": "#689d6a",
    "white": "#a89984",
    "brightBlack": "#928374",
    "brightRed": "#fb4934",
    "brightGreen": "#b8bb26",
    "brightYellow": "#fabd2f",
    "brightBlue": "#83a598",
    "brightMagenta": "#d3869b",
    "brightCyan": "#8ec07c",
    "brightWhite": "#ebdbb2"
  }
}
