{
  "id": "riso",
  "name": "Riso",
  "type": "light",
  "author": "Baris Can Sayin",
  "description": "Risograph print on cream paper. Fluorescent pink, soybean yellow, federal blue — slightly off-register, slightly handmade.",
  "ui": {
    "background": "#f4ecd6",
    "foreground": "#1a1812",
    "card": "#ebe2c4",
    "cardForeground": "#1a1812",
    "popover": "#ebe2c4",
    "popoverForeground": "#1a1812",
    "primary": "#ff5290",
    "primaryForeground": "#1a1812",
    "secondary": "#e3d8b3",
    "secondaryForeground": "#1a1812",
    "muted": "#e3d8b3",
    "mutedForeground": "#6e6850",
    "accent": "#dccba0",
    "accentForeground": "#1a1812",
    "tertiary": "#efe7ce",
    "tertiaryActive": "#dccba0",
    "destructive": "#c3263a",
    "destructiveForeground": "#f4ecd6",
    "border": "#d8c8a0",
    "input": "#ebe2c4",
    "ring": "#1f4f8a",
    "sidebar": "#efe7ce",
    "sidebarForeground": "#1a1812",
    "sidebarPrimary": "#ff5290",
    "sidebarPrimaryForeground": "#1a1812",
    "sidebarAccent": "#dccba0",
    "sidebarAccentForeground": "#1a1812",
    "sidebarBorder": "#d8c8a0",
    "sidebarRing": "#ff5290",
    "chart1": "#ff5290",
    "chart2": "#7fcfa6",
    "chart3": "#1f4f8a",
    "chart4": "#f8c93b",
    "chart5": "#7c2c8a",
    "highlightMatch": "rgba(248, 201, 59, 0.22)",
    "highlightActive": "rgba(255, 82, 144, 0.35)",
    "highlight": "#f8c93b",
    "highlightForeground": "#1a1812"
  },
  "terminal": {
    "background": "#f4ecd6",
    "foreground": "#1a1812",
    "cursor": "#ff5290",
    "cursorAccent": "#f4ecd6",
    "selectionBackground": "rgba(216, 200, 160, 0.65)",
    "black": "#2a261c",
    "red": "#c3263a",
    "green": "#5f8a6a",
    "yellow": "#c89a25",
    "blue": "#1f4f8a",
    "magenta": "#ff5290",
    "cyan": "#5d8a98",
    "white": "#ebe2c4",
    "brightBlack": "#6e6850",
    "brightRed": "#e84660",
    "brightGreen": "#7fcfa6",
    "brightYellow": "#f8c93b",
    "brightBlue": "#3a6cb0",
    "brightMagenta": "#ff7aae",
    "brightCyan": "#7da9b8",
    "brightWhite": "#fbf4dc"
  }
}
