{
  "id": "ferro",
  "name": "Ferro",
  "type": "dark",
  "author": "Baris Can Sayin",
  "description": "A blacksmith's forge at first light. Cold dark steel meets hot orange embers — the metal hasn't lost its memory of fire.",
  "ui": {
    "background": "#15181c",
    "foreground": "#dcd4c8",
    "card": "#1d2127",
    "cardForeground": "#dcd4c8",
    "popover": "#1d2127",
    "popoverForeground": "#dcd4c8",
    "primary": "#e85d1e",
    "primaryForeground": "#15181c",
    "secondary": "#262a32",
    "secondaryForeground": "#dcd4c8",
    "muted": "#262a32",
    "mutedForeground": "#857d70",
    "accent": "#3a3d44",
    "accentForeground": "#f0e8d8",
    "tertiary": "#0c0d10",
    "tertiaryActive": "#3a3d44",
    "destructive": "#c63a1c",
    "destructiveForeground": "#f0e8d8",
    "border": "#3a3d44",
    "input": "#1d2127",
    "ring": "#e85d1e",
    "sidebar": "#0c0d10",
    "sidebarForeground": "#bdb4a4",
    "sidebarPrimary": "#e85d1e",
    "sidebarPrimaryForeground": "#15181c",
    "sidebarAccent": "#1d2127",
    "sidebarAccentForeground": "#dcd4c8",
    "sidebarBorder": "#1d2127",
    "sidebarRing": "#e85d1e",
    "chart1": "#c63a1c",
    "chart2": "#83a85c",
    "chart3": "#5a8b9b",
    "chart4": "#f5b042",
    "chart5": "#e85d1e",
    "highlightMatch": "rgba(245, 176, 66, 0.18)",
    "highlightActive": "rgba(232, 93, 30, 0.4)",
    "highlight": "#f5b042",
    "highlightForeground": "#15181c"
  },
  "terminal": {
    "background": "#15181c",
    "foreground": "#dcd4c8",
    "cursor": "#e85d1e",
    "cursorAccent": "#15181c",
    "selectionBackground": "rgba(58, 61, 68, 0.85)",
    "black": "#0c0d10",
    "red": "#c63a1c",
    "green": "#83a85c",
    "yellow": "#f5b042",
    "blue": "#5a8b9b",
    "magenta": "#a85a3a",
    "cyan": "#7ea3a8",
    "white": "#bdb4a4",
    "brightBlack": "#3a3d44",
    "brightRed": "#e85d1e",
    "brightGreen": "#a8c878",
    "brightYellow": "#ffd078",
    "brightBlue": "#7da6b8",
    "brightMagenta": "#c87a5a",
    "brightCyan": "#a3c4c9",
    "brightWhite": "#f0e8d8"
  }
}
