{
  "id": "atlas",
  "name": "Atlas",
  "type": "light",
  "author": "Baris Can Sayin",
  "description": "An old map atlas opened on a library table. Faded teal water, dust-rose place names, mountain-shadow brown on parchment.",
  "ui": {
    "background": "#ebe2cb",
    "foreground": "#2a2620",
    "card": "#e0d6bb",
    "cardForeground": "#2a2620",
    "popover": "#e0d6bb",
    "popoverForeground": "#2a2620",
    "primary": "#3e7a78",
    "primaryForeground": "#ebe2cb",
    "secondary": "#d4caa7",
    "secondaryForeground": "#2a2620",
    "muted": "#d4caa7",
    "mutedForeground": "#6a5e48",
    "accent": "#c8bd96",
    "accentForeground": "#2a2620",
    "tertiary": "#e6dcc1",
    "tertiaryActive": "#c8bd96",
    "destructive": "#a8473a",
    "destructiveForeground": "#ebe2cb",
    "border": "#b3a684",
    "input": "#e0d6bb",
    "ring": "#3e7a78",
    "sidebar": "#e6dcc1",
    "sidebarForeground": "#2a2620",
    "sidebarPrimary": "#3e7a78",
    "sidebarPrimaryForeground": "#ebe2cb",
    "sidebarAccent": "#d4caa7",
    "sidebarAccentForeground": "#2a2620",
    "sidebarBorder": "#b3a684",
    "sidebarRing": "#3e7a78",
    "chart1": "#a8473a",
    "chart2": "#5b773d",
    "chart3": "#3e7a78",
    "chart4": "#c89e4f",
    "chart5": "#6e5294",
    "highlightMatch": "rgba(200, 158, 79, 0.22)",
    "highlightActive": "rgba(200, 158, 79, 0.5)",
    "highlight": "#c89e4f",
    "highlightForeground": "#2a2620"
  },
  "terminal": {
    "background": "#ebe2cb",
    "foreground": "#2a2620",
    "cursor": "#3e7a78",
    "cursorAccent": "#ebe2cb",
    "selectionBackground": "rgba(179, 166, 132, 0.55)",
    "black": "#2a2620",
    "red": "#a8473a",
    "green": "#5b773d",
    "yellow": "#c89e4f",
    "blue": "#3e7a78",
    "magenta": "#6e5294",
    "cyan": "#5d8a85",
    "white": "#e0d6bb",
    "brightBlack": "#6a5e48",
    "brightRed": "#bd5848",
    "brightGreen": "#7a934e",
    "brightYellow": "#dfb55e",
    "brightBlue": "#549494",
    "brightMagenta": "#8770ad",
    "brightCyan": "#7aa6a0",
    "brightWhite": "#f3eadb"
  }
}
