{
  "id": "catppuccin-mocha",
  "name": "Catppuccin Mocha",
  "type": "dark",
  "author": "Catppuccin (port: Baris Can Sayin)",
  "description": "A soothing pastel theme with mid-light desaturated accents on a warm dark base. The darkest of the four Catppuccin flavors.",
  "ui": {
    "background": "#1e1e2e",
    "foreground": "#cdd6f4",
    "card": "#181825",
    "cardForeground": "#cdd6f4",
    "popover": "#181825",
    "popoverForeground": "#cdd6f4",
    "primary": "#cba6f7",
    "primaryForeground": "#1e1e2e",
    "secondary": "#313244",
    "secondaryForeground": "#cdd6f4",
    "muted": "#313244",
    "mutedForeground": "#7f849c",
    "accent": "#45475a",
    "accentForeground": "#cdd6f4",
    "tertiary": "#11111b",
    "tertiaryActive": "#45475a",
    "destructive": "#f38ba8",
    "destructiveForeground": "#1e1e2e",
    "border": "#45475a",
    "input": "#313244",
    "ring": "#cba6f7",
    "sidebar": "#181825",
    "sidebarForeground": "#bac2de",
    "sidebarPrimary": "#cba6f7",
    "sidebarPrimaryForeground": "#1e1e2e",
    "sidebarAccent": "#313244",
    "sidebarAccentForeground": "#cdd6f4",
    "sidebarBorder": "#11111b",
    "sidebarRing": "#cba6f7",
    "chart1": "#f38ba8",
    "chart2": "#a6e3a1",
    "chart3": "#89dceb",
    "chart4": "#f9e2af",
    "chart5": "#cba6f7",
    "highlightMatch": "rgba(249, 226, 175, 0.16)",
    "highlightActive": "rgba(245, 194, 231, 0.4)",
    "highlight": "#f5c2e7",
    "highlightForeground": "#1e1e2e"
  },
  "terminal": {
    "background": "#1e1e2e",
    "foreground": "#cdd6f4",
    "cursor": "#f5e0dc",
    "cursorAccent": "#1e1e2e",
    "selectionBackground": "rgba(88, 91, 112, 0.7)",
    "black": "#45475a",
    "red": "#f38ba8",
    "green": "#a6e3a1",
    "yellow": "#f9e2af",
    "blue": "#89b4fa",
    "magenta": "#f5c2e7",
    "cyan": "#94e2d5",
    "white": "#bac2de",
    "brightBlack": "#585b70",
    "brightRed": "#f38ba8",
    "brightGreen": "#a6e3a1",
    "brightYellow": "#f9e2af",
    "brightBlue": "#89b4fa",
    "brightMagenta": "#f5c2e7",
    "brightCyan": "#94e2d5",
    "brightWhite": "#a6adc8"
  }
}
