{
  "id": "vellum",
  "name": "Vellum",
  "type": "light",
  "author": "Baris Can Sayin",
  "description": "Cream paper, deep ink, sepia accent. A typography-first light theme that prints as well as it screens.",
  "ui": {
    "background": "#f5efdc",
    "foreground": "#1a1814",
    "card": "#ede5cc",
    "cardForeground": "#1a1814",
    "popover": "#ede5cc",
    "popoverForeground": "#1a1814",
    "primary": "#8b3a1a",
    "primaryForeground": "#f5efdc",
    "secondary": "#e2d8b8",
    "secondaryForeground": "#1a1814",
    "muted": "#e2d8b8",
    "mutedForeground": "#6b5d3c",
    "accent": "#dccea7",
    "accentForeground": "#1a1814",
    "tertiary": "#efe7d0",
    "tertiaryActive": "#dccea7",
    "destructive": "#a82e2e",
    "destructiveForeground": "#f5efdc",
    "border": "#c8b896",
    "input": "#ede5cc",
    "ring": "#8b3a1a",
    "sidebar": "#efe7d0",
    "sidebarForeground": "#1a1814",
    "sidebarPrimary": "#8b3a1a",
    "sidebarPrimaryForeground": "#f5efdc",
    "sidebarAccent": "#dccea7",
    "sidebarAccentForeground": "#1a1814",
    "sidebarBorder": "#c8b896",
    "sidebarRing": "#8b3a1a",
    "chart1": "#a82e2e",
    "chart2": "#5e6b3a",
    "chart3": "#4d6b6b",
    "chart4": "#a8862a",
    "chart5": "#5b3e6b",
    "highlightMatch": "rgba(168, 134, 42, 0.18)",
    "highlightActive": "rgba(168, 134, 42, 0.4)",
    "highlight": "#a8862a",
    "highlightForeground": "#1a1814"
  },
  "terminal": {
    "background": "#f5efdc",
    "foreground": "#1a1814",
    "cursor": "#8b3a1a",
    "cursorAccent": "#f5efdc",
    "selectionBackground": "rgba(200, 184, 150, 0.65)",
    "black": "#2a2620",
    "red": "#a82e2e",
    "green": "#5e6b3a",
    "yellow": "#a8862a",
    "blue": "#4d6b6b",
    "magenta": "#5b3e6b",
    "cyan": "#5d7a78",
    "white": "#ede5cc",
    "brightBlack": "#6b5d3c",
    "brightRed": "#c14747",
    "brightGreen": "#7a8a4c",
    "brightYellow": "#c4a345",
    "brightBlue": "#5e8786",
    "brightMagenta": "#785588",
    "brightCyan": "#7a9694",
    "brightWhite": "#fcf6e3"
  }
}
