{
  "id": "rose-pine",
  "name": "Rosé Pine",
  "type": "dark",
  "author": "Rosé Pine team (port: Baris Can Sayin)",
  "description": "All natural pine, faux fur and a bit of soho vibes for the classy minimalist. The original 'Main' variant.",
  "ui": {
    "background": "#191724",
    "foreground": "#e0def4",
    "card": "#1f1d2e",
    "cardForeground": "#e0def4",
    "popover": "#1f1d2e",
    "popoverForeground": "#e0def4",
    "primary": "#c4a7e7",
    "primaryForeground": "#191724",
    "secondary": "#26233a",
    "secondaryForeground": "#e0def4",
    "muted": "#26233a",
    "mutedForeground": "#6e6a86",
    "accent": "#403d52",
    "accentForeground": "#e0def4",
    "tertiary": "#16141f",
    "tertiaryActive": "#403d52",
    "destructive": "#eb6f92",
    "destructiveForeground": "#191724",
    "border": "#403d52",
    "input": "#26233a",
    "ring": "#c4a7e7",
    "sidebar": "#16141f",
    "sidebarForeground": "#e0def4",
    "sidebarPrimary": "#c4a7e7",
    "sidebarPrimaryForeground": "#191724",
    "sidebarAccent": "#26233a",
    "sidebarAccentForeground": "#e0def4",
    "sidebarBorder": "#1f1d2e",
    "sidebarRing": "#c4a7e7",
    "chart1": "#eb6f92",
    "chart2": "#9ccfd8",
    "chart3": "#31748f",
    "chart4": "#f6c177",
    "chart5": "#c4a7e7",
    "highlightMatch": "rgba(246, 193, 119, 0.18)",
    "highlightActive": "rgba(196, 167, 231, 0.4)",
    "highlight": "#f6c177",
    "highlightForeground": "#191724"
  },
  "terminal": {
    "background": "#191724",
    "foreground": "#e0def4",
    "cursor": "#e0def4",
    "cursorAccent": "#191724",
    "selectionBackground": "rgba(64, 61, 82, 0.85)",
    "black": "#26233a",
    "red": "#eb6f92",
    "green": "#31748f",
    "yellow": "#f6c177",
    "blue": "#9ccfd8",
    "magenta": "#c4a7e7",
    "cyan": "#ebbcba",
    "white": "#e0def4",
    "brightBlack": "#6e6a86",
    "brightRed": "#eb6f92",
    "brightGreen": "#31748f",
    "brightYellow": "#f6c177",
    "brightBlue": "#9ccfd8",
    "brightMagenta": "#c4a7e7",
    "brightCyan": "#ebbcba",
    "brightWhite": "#e0def4"
  }
}
