{
  "id": "dracula",
  "name": "Dracula",
  "type": "dark",
  "author": "Zeno Rocha (port: Baris Can Sayin)",
  "description": "A faithful port of Dracula — the dark theme with cyan, green, orange, pink, purple, red, yellow on deep slate.",
  "ui": {
    "background": "#282a36",
    "foreground": "#f8f8f2",
    "card": "#21222c",
    "cardForeground": "#f8f8f2",
    "popover": "#21222c",
    "popoverForeground": "#f8f8f2",
    "primary": "#bd93f9",
    "primaryForeground": "#282a36",
    "secondary": "#44475a",
    "secondaryForeground": "#f8f8f2",
    "muted": "#44475a",
    "mutedForeground": "#6272a4",
    "accent": "#44475a",
    "accentForeground": "#f8f8f2",
    "tertiary": "#1e1f29",
    "tertiaryActive": "#44475a",
    "destructive": "#ff5555",
    "destructiveForeground": "#f8f8f2",
    "border": "#44475a",
    "input": "#44475a",
    "ring": "#bd93f9",
    "sidebar": "#21222c",
    "sidebarForeground": "#f8f8f2",
    "sidebarPrimary": "#bd93f9",
    "sidebarPrimaryForeground": "#282a36",
    "sidebarAccent": "#44475a",
    "sidebarAccentForeground": "#f8f8f2",
    "sidebarBorder": "#191a21",
    "sidebarRing": "#bd93f9",
    "chart1": "#ff5555",
    "chart2": "#50fa7b",
    "chart3": "#8be9fd",
    "chart4": "#f1fa8c",
    "chart5": "#bd93f9",
    "highlightMatch": "rgba(241, 250, 140, 0.25)",
    "highlightActive": "rgba(255, 121, 198, 0.45)",
    "highlight": "#ff79c6",
    "highlightForeground": "#282a36"
  },
  "terminal": {
    "background": "#282a36",
    "foreground": "#f8f8f2",
    "cursor": "#f8f8f2",
    "cursorAccent": "#282a36",
    "selectionBackground": "rgba(68, 71, 90, 0.85)",
    "black": "#21222c",
    "red": "#ff5555",
    "green": "#50fa7b",
    "yellow": "#f1fa8c",
    "blue": "#bd93f9",
    "magenta": "#ff79c6",
    "cyan": "#8be9fd",
    "white": "#f8f8f2",
    "brightBlack": "#6272a4",
    "brightRed": "#ff6e6e",
    "brightGreen": "#69ff94",
    "brightYellow": "#ffffa5",
    "brightBlue": "#d6acff",
    "brightMagenta": "#ff92df",
    "brightCyan": "#a4ffff",
    "brightWhite": "#ffffff"
  }
}
