{
  "id": "inkwell",
  "name": "Inkwell",
  "type": "light",
  "author": "Baris Can Sayin",
  "description": "Fountain-pen blue ink on bone-white paper. A long-form essayist's draft surface — patient, literary, cool.",
  "ui": {
    "background": "#f7f3eb",
    "foreground": "#1c2840",
    "card": "#ede8db",
    "cardForeground": "#1c2840",
    "popover": "#ede8db",
    "popoverForeground": "#1c2840",
    "primary": "#2c4a8a",
    "primaryForeground": "#f7f3eb",
    "secondary": "#e2dcc7",
    "secondaryForeground": "#1c2840",
    "muted": "#e2dcc7",
    "mutedForeground": "#5b6a85",
    "accent": "#d9d2ba",
    "accentForeground": "#1c2840",
    "tertiary": "#f0ebde",
    "tertiaryActive": "#d9d2ba",
    "destructive": "#9c3a3a",
    "destructiveForeground": "#f7f3eb",
    "border": "#d4cdb8",
    "input": "#ede8db",
    "ring": "#2c4a8a",
    "sidebar": "#f0ebde",
    "sidebarForeground": "#1c2840",
    "sidebarPrimary": "#2c4a8a",
    "sidebarPrimaryForeground": "#f7f3eb",
    "sidebarAccent": "#d9d2ba",
    "sidebarAccentForeground": "#1c2840",
    "sidebarBorder": "#d4cdb8",
    "sidebarRing": "#2c4a8a",
    "chart1": "#9c3a3a",
    "chart2": "#566b3e",
    "chart3": "#2c4a8a",
    "chart4": "#cda85c",
    "chart5": "#5b3e6b",
    "highlightMatch": "rgba(205, 168, 92, 0.18)",
    "highlightActive": "rgba(205, 168, 92, 0.42)",
    "highlight": "#cda85c",
    "highlightForeground": "#1c2840"
  },
  "terminal": {
    "background": "#f7f3eb",
    "foreground": "#1c2840",
    "cursor": "#2c4a8a",
    "cursorAccent": "#f7f3eb",
    "selectionBackground": "rgba(212, 205, 184, 0.7)",
    "black": "#1c2840",
    "red": "#9c3a3a",
    "green": "#566b3e",
    "yellow": "#cda85c",
    "blue": "#2c4a8a",
    "magenta": "#5b3e6b",
    "cyan": "#3e6b78",
    "white": "#ede8db",
    "brightBlack": "#5b6a85",
    "brightRed": "#b8504a",
    "brightGreen": "#74874f",
    "brightYellow": "#dfb56c",
    "brightBlue": "#3a609e",
    "brightMagenta": "#785588",
    "brightCyan": "#578799",
    "brightWhite": "#fcf8ee"
  }
}
