{
  "id": "solarized-light",
  "name": "Solarized Light",
  "type": "light",
  "author": "Ethan Schoonover (port: Baris Can Sayin)",
  "description": "Precision colors engineered for legibility — light variant. Cream paper base, ink foreground, same accent hues as Solarized Dark.",
  "ui": {
    "background": "#fdf6e3",
    "foreground": "#586e75",
    "card": "#eee8d5",
    "cardForeground": "#073642",
    "popover": "#eee8d5",
    "popoverForeground": "#073642",
    "primary": "#268bd2",
    "primaryForeground": "#002b36",
    "secondary": "#eee8d5",
    "secondaryForeground": "#657b83",
    "muted": "#eee8d5",
    "mutedForeground": "#93a1a1",
    "accent": "#eee8d5",
    "accentForeground": "#073642",
    "tertiary": "#f5eecb",
    "tertiaryActive": "#eee8d5",
    "destructive": "#dc322f",
    "destructiveForeground": "#fdf6e3",
    "border": "#eee8d5",
    "input": "#eee8d5",
    "ring": "#268bd2",
    "sidebar": "#f5eecb",
    "sidebarForeground": "#657b83",
    "sidebarPrimary": "#268bd2",
    "sidebarPrimaryForeground": "#002b36",
    "sidebarAccent": "#eee8d5",
    "sidebarAccentForeground": "#073642",
    "sidebarBorder": "#eee8d5",
    "sidebarRing": "#268bd2",
    "chart1": "#dc322f",
    "chart2": "#859900",
    "chart3": "#2aa198",
    "chart4": "#b58900",
    "chart5": "#6c71c4",
    "highlightMatch": "rgba(181, 137, 0, 0.18)",
    "highlightActive": "rgba(181, 137, 0, 0.4)",
    "highlight": "#b58900",
    "highlightForeground": "#fdf6e3"
  },
  "terminal": {
    "background": "#fdf6e3",
    "foreground": "#657b83",
    "cursor": "#586e75",
    "cursorAccent": "#fdf6e3",
    "selectionBackground": "rgba(238, 232, 213, 0.95)",
    "black": "#073642",
    "red": "#dc322f",
    "green": "#859900",
    "yellow": "#b58900",
    "blue": "#268bd2",
    "magenta": "#d33682",
    "cyan": "#2aa198",
    "white": "#eee8d5",
    "brightBlack": "#002b36",
    "brightRed": "#cb4b16",
    "brightGreen": "#586e75",
    "brightYellow": "#657b83",
    "brightBlue": "#839496",
    "brightMagenta": "#6c71c4",
    "brightCyan": "#93a1a1",
    "brightWhite": "#fdf6e3"
  }
}
